{
  "$schema": "http://json-schema.org/draft-07/schema#",
  "$id": "https://tttrlib.readthedocs.io/sim.schema.json",
  "title": "tttrlib photon-simulation config",
  "description": "Configuration accepted by tttrlib.SimEngine.from_json(...) — the single entry point for the photon simulator. Diffusion, rate, and brightness quantities share ONE abstract macro-time unit (the ms convention is common); the micro-time / TAC axis is a separate axis in nanoseconds. See the simulator manual for the full physics and the routing-channel configuration model (FRET, PIE, MFD, anisotropy).",
  "type": "object",
  "additionalProperties": false,
  "properties": {
    "_comment": {"type": "string", "description": "Free-text description of the configuration (ignored by the engine)."},
    "settings": {
      "type": "object",
      "description": "Time base, RNG, micro-time axis, stop conditions, and opt-in throughput knobs (SimIntegrator).",
      "additionalProperties": false,
      "properties": {
        "dt": {"type": "number", "default": 0.01, "exclusiveMinimum": 0,
          "description": "Diffusion/integration time-window in the macro-time unit (ms convention: 0.001 = 1 µs). Sets diffusion resolution; do not enlarge for speed (sub-stepped internally)."},
        "n_ph_max": {"type": "integer", "default": 1000000, "minimum": 1,
          "description": "Stop after this many photons (fixed-count mode). Use max_windows for a fixed duration."},
        "max_windows": {"type": "integer", "default": 0, "minimum": 0,
          "description": "Fixed-DURATION stop: duration = max_windows × dt (0 = unlimited). Required by independent_molecules; then n_ph_max is ignored."},
        "n_channels": {"type": "integer", "default": 2, "minimum": 1,
          "description": "Number of detection (routing) channels = product of the physical routings (spectral × polarization × PIE window)."},
        "seed_diffusion": {"type": "integer", "default": 12345, "minimum": 0,
          "description": "RNG seed for diffusion, geometry and state transitions."},
        "seed_emission": {"type": "integer", "default": 54321, "minimum": 0,
          "description": "RNG seed for emission, channel choice and background."},
        "n_microtime_channels": {"type": "integer", "default": 4096, "minimum": 1,
          "description": "Number of micro-time (TCSPC/TAC) channels on the fluorescence-decay axis."},
        "microtime_resolution": {"type": "number", "default": 0.008, "minimum": 0,
          "description": "Micro-time channel width in NANOSECONDS (TAC resolution)."},
        "laser_period": {"type": "number", "default": 32.0, "minimum": 0,
          "description": "Pulsed-excitation period in NANOSECONDS; micro-times wrap modulo this. Its sub-windows carry PIE prompt/delay."},
        "alex_period": {"type": "number", "default": 0.0, "minimum": 0,
          "description": "ALEX (alternating laser excitation) period in MACRO-time units (same as dt). With >= 2 excitation grids each macro-window is assigned to laser floor(fmod(T0*dt, alex_period)/(alex_period/n_lasers)) — a macro-time laser alternation (unlike laser_period, the ns TCSPC pulse). 0 = off (single laser)."},
        "alex_markers": {"type": "boolean", "default": false,
          "description": "Emit a marker event (event_type = alex_marker_event_type, routing channel = laser index) at each ALEX laser switch, as explicit ground truth. Preserved by lossless containers; dropped by SM."},
        "alex_marker_event_type": {"type": "integer", "default": 2,
          "description": "event_type written for ALEX laser-switch markers (scan markers use 1)."},
        "rng_kind": {"type": "string", "enum": ["xoshiro", "pcg", "philox", "mt19937", "mt"], "default": "xoshiro",
          "description": "RNG backend. All are thread-count-independent; xoshiro is the fast default."},
        "rng_scope": {"type": "string", "enum": ["per_molecule", "per_thread"], "default": "per_molecule",
          "description": "RNG stream granularity. per_molecule is reproducible regardless of thread count."},
        "per_molecule_skip": {"type": "boolean", "default": false,
          "description": "Coasting: skip per-window work for molecules far from the focus; exact catch-up on wake. Big speedup for dilute samples."},
        "coast_safety": {"type": "number", "default": 3.0, "minimum": 1.0,
          "description": "Coast bound: step std ≤ distance-to-boundary / coast_safety. Only used with coasting."},
        "min_coast_windows": {"type": "integer", "default": 8, "minimum": 1,
          "description": "Minimum sleep length in windows. Only used with coasting."},
        "focus_threshold": {"type": "number", "default": 0.001, "minimum": 0, "maximum": 1,
          "description": "Fraction of peak excitation defining the effective-focus box used by coasting, the two-step lookup and active_margin."},
        "drift_midpoint": {"type": "boolean", "default": true,
          "description": "Integrate the flow drift with an explicit midpoint step instead of plain Euler. Only non-uniform fields are affected (a uniform field is a constant drift, integrated exactly either way). Costs one extra field lookup per step (~30% of run time on a grid field). Safe to disable for pure-shear transport such as poiseuille, whose Jacobian is nilpotent so Euler is volume-exact; keep it on for rotation or any field with vorticity or strain, where Euler inflates or contracts phase-space volume every step and molecules drift radially."},
        "fast_grid_bbox": {"type": "boolean", "default": false,
          "description": "Two-step field lookup: reject far-from-focus queries with a bounding box before the trilinear interpolation."},
        "independent_molecules": {"type": "boolean", "default": false,
          "description": "Simulate each molecule's whole timeline independently and merge — parallel across molecules. Requires max_windows > 0; ignores n_ph_max."},
        "active_margin": {"type": "number", "default": 0.0, "minimum": 0,
          "description": "Open-volume: shrink the box to focus+margin (µm), holding concentration, so far molecules are skipped. Exact for diffusion; for kinetics use margin ≳ √(2·D/k). 0 = off."}
      }
    },
    "box": {
      "type": "object", "additionalProperties": false,
      "description": "Ellipsoidal open-volume box (µm). With population, sets the concentration = M / box volume.",
      "properties": {
        "xy": {"type": "number", "default": 2.0, "minimum": 0, "description": "Lateral half-extent (µm)."},
        "z": {"type": "number", "default": 4.0, "minimum": 0, "description": "Axial half-extent (µm)."}
      }
    },
    "species": {
      "type": "array",
      "description": "Photophysical / conformational states. Model each emitting state (donor-excited, acceptor-via-FRET, dark, directly-excited-acceptor for PIE, …) as a species; FRET E, PIE window and per-channel lifetime are encoded via q + decay, not new physics.",
      "items": {
        "type": "object", "additionalProperties": false,
        "properties": {
          "D": {"type": "number", "default": 0.0, "minimum": 0,
            "description": "Translational diffusion coefficient, µm² per macro-time unit (ms ⇒ µm²/ms). 0 = immobile."},
          "q": {"type": "array", "items": {"type": "number", "minimum": 0},
            "description": "Peak brightness per channel (photons per macro-time unit at the focus centre). The channel split encodes FRET color routing / anisotropy; q_green ∝ (1−E), q_red ∝ E."},
          "q_alex": {"type": "array", "items": {"type": "array", "items": {"type": "number", "minimum": 0}},
            "description": "ALEX per-laser brightness rows q_alex[laser][channel] (one row per excitation grid). Empty ⇒ q broadcast to all lasers. A doubly-labelled FRET species uses [[(1-E)b, E·b], [0, b_A]] so it emits DD+DA under the green laser and AA under the red laser."},
          "r0": {"type": "number", "default": 0.0, "minimum": -0.2, "maximum": 0.4,
            "description": "Fundamental anisotropy. >0 enables photoselection + depolarization (needs a decay)."},
          "l1": {"type": "number", "default": 0.0, "description": "Detection polarization mixing, parallel channel."},
          "l2": {"type": "number", "default": 0.0, "description": "Detection polarization mixing, perpendicular channel."},
          "D_rot": {"type": "number", "default": 0.0, "minimum": 0,
            "description": "Rotational diffusion coefficient, rad²/ns; depolarizes over the lifetime (Perrin)."},
          "v_scale": {"type": "number", "default": 1.0, "minimum": 0,
            "description": "Coupling of this species to the global flow field. 0 = not advected (e.g. surface-bound)."},
          "decay": {"$ref": "#/definitions/decay"}
        }
      }
    },
    "k_rad": {"type": "array", "items": {"type": "number"},
      "description": "N×N row-major (i→j) transition rates SCALED by local excitation intensity (photo-induced / FRET-type), per macro-time unit. Length N_species²."},
    "k_nrad": {"type": "array", "items": {"type": "number"},
      "description": "N×N row-major (i→j) SPONTANEOUS transition rates (blinking, conformational exchange), per macro-time unit. Length N_species²."},
    "background": {"type": "array", "items": {"type": "number", "minimum": 0},
      "description": "Uncorrelated background rate per channel (photons per macro-time unit)."},
    "background_decay": {"$ref": "#/definitions/decay",
      "description": "Optional micro-time pattern for background photons (scatter/IRF or flat); broadcast to all channels."},
    "population": {"type": "array", "items": {"type": "number", "minimum": 0},
      "description": "Open-volume expected molecule count per species in the box (index = species)."},
    "flow": {
      "type": "object", "additionalProperties": false,
      "description": "Uniform velocity field, Poiseuille flow, rigid rotation, or a field from three component arrays. A divergence-free field must be used for a stationary, homogeneous correlation analysis (see the simulator guide).",
      "properties": {
        "type": {"type": "string", "enum": ["uniform", "poiseuille", "rotation", "components"], "default": "uniform",
          "description": "Flow-field type. uniform: constant vx,vy,vz (analytic, no lattice). poiseuille: Hagen-Poiseuille pipe flow along axis. rotation: rigid-body rotation about axis. components: arbitrary field from three same-shaped voxel arrays."},
        "vx": {"type": "number", "default": 0.0, "description": "X velocity (µm/macro-time) for uniform type."},
        "vy": {"type": "number", "default": 0.0, "description": "Y velocity (µm/macro-time) for uniform type."},
        "vz": {"type": "number", "default": 0.0, "description": "Z velocity (µm/macro-time) for uniform type."},
        "v_max": {"type": "number", "default": 0.0, "description": "Peak velocity (µm/macro-time) for poiseuille type."},
        "radius": {"type": "number", "default": 1.0, "minimum": 0, "description": "Pipe radius (µm) for poiseuille type."},
        "axis": {"type": "integer", "default": 0, "minimum": 0, "maximum": 2,
          "description": "Flow axis: 0=x, 1=y, 2=z. For poiseuille the axis of the pipe; for rotation the axis of rotation."},
        "omega": {"type": "number", "default": 0.0, "description": "Angular velocity (rad/macro-time) for rotation type."},
        "extent_xy": {"type": "number", "default": 2.0, "description": "Grid half-extent XY (µm) for poiseuille/rotation lattice."},
        "extent_z": {"type": "number", "default": 4.0, "description": "Grid half-extent Z (µm) for poiseuille/rotation lattice."},
        "spacing": {"type": "number", "default": 0.1, "description": "Voxel spacing (µm) for poiseuille/rotation/component lattices."},
        "nx": {"type": "integer", "description": "Grid X dimension for components type."},
        "ny": {"type": "integer", "description": "Grid Y dimension for components type."},
        "nz": {"type": "integer", "description": "Grid Z dimension for components type."},
        "dx": {"type": "number", "default": 0.1, "description": "X voxel spacing (µm) for components type."},
        "dy": {"type": "number", "default": 0.1, "description": "Y voxel spacing (µm) for components type."},
        "dz": {"type": "number", "default": 0.1, "description": "Z voxel spacing (µm) for components type."},
        "x0": {"type": "number", "default": 0.0, "description": "Physical X origin of the components lattice."},
        "y0": {"type": "number", "default": 0.0, "description": "Physical Y origin of the components lattice."},
        "z0": {"type": "number", "default": 0.0, "description": "Physical Z origin of the components lattice."}
      }
    },
    "occlusion": {
      "type": "object", "additionalProperties": false,
      "description": "Occlusion mask: a scalar field in [0,1] where 0 = free, 1 = impermeable. Molecules propose a step and accept it with probability 1 − occ(destination). A slab thinner than 4·sqrt(2·D·dt) may be tunnelled. Partial occlusion (0 < occ < 1) combined with flow is outside the validated regime.",
      "properties": {
        "nx": {"type": "integer", "description": "Grid X dimension."},
        "ny": {"type": "integer", "description": "Grid Y dimension."},
        "nz": {"type": "integer", "description": "Grid Z dimension."},
        "dx": {"type": "number", "default": 0.1, "description": "X voxel spacing (µm)."},
        "dy": {"type": "number", "default": 0.1, "description": "Y voxel spacing (µm)."},
        "dz": {"type": "number", "default": 0.1, "description": "Z voxel spacing (µm)."},
        "x0": {"type": "number", "default": 0.0, "description": "Physical X origin."},
        "y0": {"type": "number", "default": 0.0, "description": "Physical Y origin."},
        "z0": {"type": "number", "default": 0.0, "description": "Physical Z origin."},
        "data": {"type": "array", "items": {"type": "number", "minimum": 0, "maximum": 1},
          "description": "Occlusion values in [0,1], row-major with x fastest. Size must be nx*ny*nz."}
      }
    },
    "emitters": {
      "type": "array",
      "description": "Explicit discrete fluorophores (e.g. immobile emitters for CLSM). Alternative to open-volume population.",
      "items": {
        "type": "object", "additionalProperties": false,
        "properties": {
          "x": {"type": "number", "default": 0.0}, "y": {"type": "number", "default": 0.0}, "z": {"type": "number", "default": 0.0},
          "species": {"type": "integer", "default": 0}, "mobile": {"type": "boolean", "default": false}
        }
      }
    },
    "excitation": {
      "description": "Excitation intensity field. A single field object = one laser (current behavior); an array of field objects = one per ALEX laser (with settings.alex_period > 0).",
      "oneOf": [
        {"$ref": "#/definitions/field"},
        {"type": "array", "items": {"$ref": "#/definitions/field"}}
      ]
    },
    "detection": {"type": "array", "items": {"$ref": "#/definitions/field"},
      "description": "Detection-efficiency field per channel (size == n_channels). Empty = uniform efficiency 1. Lateral x0/y0 offsets between channels give ISM."}
  },
  "definitions": {
    "field": {
      "type": "object",
      "description": "Excitation/detection field. Either an analytic/parametric focus or a numeric/measured PSF filling a voxel grid.",
      "properties": {
        "type": {"type": "string", "enum": ["gaussian3d", "analytic_gaussian3d", "gaussian_lorentzian", "radial", "uniform"], "default": "uniform"},
        "w0": {"type": "number", "default": 0.3, "description": "Lateral 1/e² radius (µm)."},
        "z0": {"type": "number", "default": 2.0, "description": "Axial 1/e² radius (µm) for gaussian3d."},
        "zR": {"type": "number", "default": 1.0, "description": "Rayleigh range (µm) for gaussian_lorentzian (w(z)² = w0²(1+(z/zR)²))."},
        "analytic": {"type": "boolean", "default": false, "description": "gaussian3d only: evaluate analytically (no voxels)."},
        "radial": {"type": "boolean", "default": false, "description": "Store a cylindrically symmetric field on a (rho, z) table instead of an x-y-z lattice. Same physics when the PSF really is symmetric about the optical axis, and much cheaper: an 81x81x161 lattice (8.5 MB) becomes 41x161 (53 kB), so the table stays in cache and the lookup is bilinear rather than trilinear. Measured 1.4x faster at 0.05 um spacing and 2.9x at 0.025 um, with the cost becoming independent of resolution. Cannot represent an astigmatic, tilted or comatic focus - anything varying with azimuth needs the lattice, which is the default."},
        "amplitude": {"type": "number", "default": 1.0},
        "value": {"type": "number", "default": 1.0, "description": "uniform only: the constant value."},
        "extent_xy": {"type": "number", "default": 2.0, "description": "Grid half-extent XY (µm); size to the focus, not the box, for cheap construction."},
        "extent_z": {"type": "number", "default": 4.0, "description": "Grid half-extent Z (µm)."},
        "spacing": {"type": "number", "default": 0.1, "description": "Voxel spacing (µm)."},
        "rz": {"type": "array", "items": {"type": "number"}, "description": "radial only: PSF on the (r,z) half-plane, row-major [iz*nr+ir]."},
        "nr": {"type": "integer", "description": "radial only: number of r samples."},
        "nz": {"type": "integer", "description": "radial only: number of z samples (z-centred)."},
        "r_step": {"type": "number", "default": 0.05, "description": "radial only: r spacing (µm)."},
        "z_step": {"type": "number", "default": 0.05, "description": "radial only: z spacing (µm)."}
      }
    },
    "decay": {
      "type": "object",
      "description": "Micro-time (FLIM/lifetime) pattern for a species or the background. Either a raw 'pattern' array or a multi-exponential built from 'lifetimes' (+ 'amplitudes', optional 'irf'). 't0' shifts the pattern within the laser period — used to place PIE prompt vs delayed emission.",
      "properties": {
        "dt": {"type": "number", "default": 0.008, "description": "Pattern bin width (ns)."},
        "t0": {"type": "number", "default": 0.0, "description": "Micro-time of bin 0 (ns); offset within the laser period for PIE."},
        "pattern": {"type": "array", "items": {"type": "number", "minimum": 0}, "description": "Arbitrary (unnormalised) decay density over micro-time bins."},
        "lifetimes": {"type": "array", "items": {"type": "number", "exclusiveMinimum": 0}, "description": "Fluorescence lifetimes (ns) for a multi-exponential decay."},
        "amplitudes": {"type": "array", "items": {"type": "number"}, "default": [1.0], "description": "Amplitudes per lifetime."},
        "n_bins": {"type": "integer", "default": 4096, "description": "Number of bins for the multi-exponential build."},
        "irf": {"type": "array", "items": {"type": "number", "minimum": 0}, "description": "Optional IRF pattern to convolve with the multi-exponential decay."}
      }
    }
  }
}
