{
  "_comment": "CHALLENGE 3: dim molecules, short lifetime. Very low brightness (q=60/60 vs normal 240/60), short tau=0.5 ns. Tests fit convergence under photon-starved conditions and whether the pipeline produces NaN rather than garbage for bursts with <10 photons.",
  "settings": {"dt": 0.01, "n_ph_max": 600000, "n_channels": 2,
               "n_microtime_channels": 4096, "microtime_resolution": 0.008, "laser_period": 32.0,
               "alex_period": 0.1, "alex_markers": false,
               "active_margin": 1.0, "fast_grid_bbox": true,
               "seed_diffusion": 555, "seed_emission": 666},
  "box": {"xy": 2.0, "z": 4.0},
  "species": [
    {"D": 0.08, "q_alex": [[48.0, 12.0], [0.0, 60.0]],
     "decay": {"lifetimes": [0.5], "amplitudes": [1.0], "dt": 0.008}},
    {"D": 0.08, "q_alex": [[12.0, 48.0], [0.0, 60.0]],
     "decay": {"lifetimes": [0.8], "amplitudes": [1.0], "dt": 0.008}}
  ],
  "k_rad": [0, 0, 0, 0],
  "k_nrad": [0, 0, 0, 0],
  "background": [0.02, 0.02],
  "population": [0.15, 0.15],
  "excitation": [
    {"type": "gaussian3d", "w0": 0.3, "z0": 2.0, "extent_xy": 2.0, "extent_z": 4.0, "spacing": 0.1},
    {"type": "gaussian3d", "w0": 0.32, "z0": 2.1, "extent_xy": 2.0, "extent_z": 4.0, "spacing": 0.1}
  ]
}
