{
  "_comment": "Pulsed-interleaved excitation (PIE) via micro-time windows. No PIE engine feature: species 0 (donor-excited FRET pair) emits in the PROMPT half of the 32 ns laser period (decay t0=0); species 1 (directly-excited acceptor) emits in the DELAYED half (decay t0=16 ns) into the red channel. Gating the micro-time on prompt vs delay separates the two excitation sources (ALEX/PIE stoichiometry). Immobile emitters keep it deterministic; use population for diffusing PIE.",
  "settings": {"dt": 0.01, "n_ph_max": 200000, "n_channels": 2,
               "n_microtime_channels": 4096, "microtime_resolution": 0.008, "laser_period": 32.0},
  "box": {"xy": 2.0, "z": 4.0},
  "species": [
    {"D": 0.0, "q": [50.0, 15.0],
     "decay": {"lifetimes": [3.5], "amplitudes": [1.0], "dt": 0.008, "t0": 0.0}},
    {"D": 0.0, "q": [0.0, 40.0],
     "decay": {"lifetimes": [3.0], "amplitudes": [1.0], "dt": 0.008, "t0": 16.0}}
  ],
  "k_rad": [0, 0, 0, 0],
  "k_nrad": [0, 0, 0, 0],
  "background": [0.0, 0.0],
  "emitters": [
    {"x": 0.0, "y": 0.0, "z": 0.0, "species": 0},
    {"x": 0.0, "y": 0.0, "z": 0.0, "species": 1}
  ],
  "excitation": {"type": "gaussian3d", "w0": 0.3, "z0": 2.0,
                 "extent_xy": 2.0, "extent_z": 4.0, "spacing": 0.1}
}
