{
  "_comment": "CHALLENGE 2: high background (10x normal). Tests whether burst search and IRF extraction survive when noise dominates. background = [0.2, 0.2] vs normal [0.02, 0.02].",
  "settings": {"dt": 0.01, "n_ph_max": 600000, "n_channels": 2,
               "n_microtime_channels": 4096, "microtime_resolution": 0.008, "laser_period": 32.0,
               "alex_period": 0.1, "alex_markers": false,
               "active_margin": 1.0, "fast_grid_bbox": true,
               "seed_diffusion": 333, "seed_emission": 444},
  "box": {"xy": 2.0, "z": 4.0},
  "species": [
    {"D": 0.05, "q_alex": [[240.0, 60.0], [0.0, 300.0]],
     "decay": {"lifetimes": [3.8], "amplitudes": [1.0], "dt": 0.008}},
    {"D": 0.05, "q_alex": [[60.0, 240.0], [0.0, 300.0]],
     "decay": {"lifetimes": [1.6], "amplitudes": [1.0], "dt": 0.008}}
  ],
  "k_rad": [0, 0, 0, 0],
  "k_nrad": [0, 0, 0, 0],
  "background": [0.2, 0.2],
  "population": [0.15, 0.15],
  "excitation": [
    {"type": "gaussian3d", "w0": 0.3, "z0": 2.0, "extent_xy": 2.0, "extent_z": 4.0, "spacing": 0.1},
    {"type": "gaussian3d", "w0": 0.32, "z0": 2.1, "extent_xy": 2.0, "extent_z": 4.0, "spacing": 0.1}
  ]
}
