{
  "_comment": "CHALLENGE 4: single species, high FRET E=0.95. All photons in red channel (ch1). Tests whether the pipeline handles a dataset with almost no green photons in bursts — Duration(green) should be -1.0 (sentinel), Mean Microtime (green) should be -1.0.",
  "settings": {"dt": 0.01, "n_ph_max": 600000, "n_channels": 2,
               "n_microtime_channels": 4096, "microtime_resolution": 0.008, "laser_period": 32.0,
               "alex_period": 0.1, "alex_markers": false,
               "active_margin": 1.0, "fast_grid_bbox": true,
               "seed_diffusion": 777, "seed_emission": 888},
  "box": {"xy": 2.0, "z": 4.0},
  "species": [
    {"D": 0.05, "q_alex": [[15.0, 285.0], [0.0, 300.0]],
     "decay": {"lifetimes": [0.3], "amplitudes": [1.0], "dt": 0.008}}
  ],
  "k_rad": [0, 0, 0, 0],
  "k_nrad": [0, 0, 0, 0],
  "background": [0.02, 0.02],
  "population": [0.30],
  "excitation": [
    {"type": "gaussian3d", "w0": 0.3, "z0": 2.0, "extent_xy": 2.0, "extent_z": 4.0, "spacing": 0.1},
    {"type": "gaussian3d", "w0": 0.32, "z0": 2.1, "extent_xy": 2.0, "extent_z": 4.0, "spacing": 0.1}
  ]
}
